,show_id,title,country,release_year,is_adult,num_seasons,description,num_episodes
639,s1841,Someone Has to Die,Mexico,2020,TV-MA,1,"In conservative 1950s Spain, the alleged relationship between a young man and a Mexican ballerino creates an uproar of harrowing consequences.",12
640,s1842,The Last Kids on Earth,United States,2020,TV-Y7,3,"When zombies and monsters invade his hometown, a scrappy 13-year-old orphan teams up with his friends in hopes of surviving the chaos.",17
641,s1848,Fireman Sam,United Kingdom,2018,TV-Y,4,"Sharing valuable lessons in fire safety for preschoolers, Fireman Sam and his animated crew from Pontypandy, Wales, are ready for any emergency.",19
642,s1849,Half & Half,United States,2005,TV-14,4,"After two estranged half-sisters in their twenties find their lives suddenly entwined, they grow closer as they get to know more about each other.",16
643,s1852,One on One,United States,2006,TV-14,5,"When his ex-wife lands a job abroad, athlete-turned-sportscaster Flex Washington assumes full-time custody of their teenage daughter, Breanna.",17
644,s1853,Power Rangers Beast Morphers,United States,2020,TV-Y7,2,A new breed of secret agents must stop a ruthless computer virus and its minions from stealing the unlimited clean energy source that created them.,13
645,s1855,Social Distance,United States,2020,TV-MA,1,"Filmed in isolation, this narrative anthology series features both dark and funny takes on how people strive to stay connected while staying apart.",14
646,s1861,The Cabin with Bert Kreischer,United States,2020,TV-MA,1,"Fast-living comic Bert Kreischer heads to a cabin for some self-care and invites his funny friends to join his quest to cleanse his mind, body and soul.",12
647,s1865,Kipo and the Age of Wonderbeasts,United States,2020,TV-Y7,3,"Making her way through a world of mutant animals, a sheltered yet scrappy girl learns how to survive – and get home – with help from her ragtag crew.",20
648,s1869,Deaf U,United States,2020,TV-MA,1,"In this reality series, a tight-knit group of Deaf and hard of hearing students share their stories and explore life at Gallaudet University.",17
649,s1874,The Haunting of Bly Manor,United States,2020,TV-MA,1,"Dead doesn't mean gone. An au pair plunges into an abyss of chilling secrets in this gothic romance from the creator of ""The Haunting of Hill House.""",15
650,s1876,Do Do Sol Sol La La Sol,South Korea,2020,TV-14,1,"A riches-to-rags pianist who loses everything but her smile is guided by twinkling little stars to a small town where she finds hope, home and love.",21
651,s1878,Private Lives,South Korea,2020,TV-14,1,"In a world where data is no longer private, con artists uncover a sinister surveillance scheme headed by the government and a greedy corporation.",19
652,s1879,The 100,United States,2020,TV-MA,7,"A century after Earth was devastated by a nuclear apocalypse, 100 space station residents are sent to the planet to determine whether it's habitable.",18
653,s1881,To the Lake,Russia,2020,TV-MA,1,"Facing the end of civilization when a terrifying plague strikes, a group risks their lives, loves — and humanity — in a brutal struggle to survive.",13
654,s1886,Bad Boy Billionaires: India,India,2020,TV-14,1,"This investigative docuseries explores the greed, fraud and corruption that built up — and ultimately brought down — India’s most infamous tycoons.",19
655,s1890,Pat a Pat Como,Not Available,2016,TV-Y,1,"For Como and his friends, each new adventure is a lesson on why it's important to be considerate — and to take care of one another!",15
656,s1891,Qurious Como,Not Available,2017,TV-Y,1,"Shrunk down in size, Como and his friends examine the wonder-filled world around them one item at a time, from foods to household goods.",20
657,s1894,DreamWorks Happy Holidays from Madagascar,United States,2005,TV-PG,1,Madagascar goes wild with holiday spirit in this set of Valentine's Day and Christmas-themed tales featuring everyone's favorite animal characters.,17
658,s1895,Emily in Paris,United States,2020,TV-MA,1,"After landing her dream job in Paris, Chicago marketing exec Emily Cooper embraces her adventurous new life while juggling work, friends and romance.",13
659,s1896,H2O: Just Add Water,Australia,2009,TV-PG,3,The gals in this fantasy series cope with the burden of growing a giant fin and transforming into mermaids whenever they come in contact with water.,16
660,s1907,Evil,United States,2019,TV-14,1,A forensic psychologist partners with a Catholic priest-in-training to investigate miracles and demonic possession in this supernatural drama.,22
661,s1908,Familiar Wife,South Korea,2018,TV-MA,1,"After receiving a bizarre chance to go back in time, a man wakes up to find that his whole life — including the person he married — is different.",13
662,s1909,Food Wars!: Shokugeki no Soma,Japan,2016,TV-MA,2,"Young chef Soma enters the prestigious Totsuki Culinary Academy, where he must emerge victorious in over-the-top cooking battles or face expulsion.",16
663,s1911,"Good Morning, Verônica",Brazil,2020,TV-MA,1,"While hunting for a dating-site predator, an underused cop discovers a husband and wife with a horrific secret — and a web of conspiracy hiding it.",12
664,s1915,Journey of an African Colony,Not Available,2018,TV-MA,1,This docuseries delves into the untold stories and unsung heroes that paved Nigeria's road to independence. Based on the books by host Olasupo Shasore.,14
665,s1916,Oktoberfest: Beer & Blood,Germany,2020,TV-MA,1,"In 1900 Munich, ambitious brewer Curt Prank uses brutal tactics on his quest to build a beer hall that will dominate the city's lucrative Oktoberfest.",22
666,s1918,Secreto bien guardado,Argentina,2019,TV-MA,1,"In 1940 Argentina, a Jewish 17-year-old on vacation with her family falls in love with a young Nazi lawyer staying at the same hotel.",14
667,s1919,Sword Art Online,Japan,2018,TV-MA,3,A video game whiz helps create a new technology that enables players to guide their online avatars with their own bodies – but a dark twist emerges.,20
668,s1923,The Parkers,United States,2003,TV-PG,5,"In this ""Moesha"" spinoff, undergraduate Kim is joined at Santa Monica College by her mother Nikki, who decides to go back to school with her daughter.",20
669,s1924,The Unicorn,United States,2019,TV-14,1,"A widowed father of two girls navigates the world of dating, surprised to learn that many women consider him a hot commodity.",21
670,s1926,You Cannot Hide,Mexico,2020,TV-MA,1,"A nurse and her daughter flee her husband’s drug-trafficking past in Mexico and assume new identities in Spain, but still face danger in Madrid.",18
671,s1929,Black Butler,Japan,2010,TV-MA,3,"In Victorian London, 12-year-old business magnate Ciel Phantomhive thwarts dangers to the queen as he's watched over by his demon butler, Sebastian.",21
672,s1930,Man with a Plan,United States,2020,TV-PG,4,"When his wife Andi returns to work, contractor Adam Burns becomes a stay-at-home dad and discovers that parenting is a tougher job than he realized.",17
673,s1934,Wentworth,Australia,2020,TV-MA,8,Bea Smith is locked up while awaiting trial for the alleged attempted murder of her husband and must learn how life works in prison.,19
674,s1948,"Whose Vote Counts, Explained",United States,2020,TV-PG,1,"The right to vote is at the foundation of America's democracy. But not every vote is created equal. How does the system work, and can it be fixed?",14
675,s1949,Van Helsing,United States,2019,TV-MA,4,"After three years in a coma, Vanessa awakens to a world ravaged by vampires. Now, she and a motley band of fellow survivors fight to stay alive.",21
676,s1950,The Good Place,United States,2020,TV-14,4,"Due to an error, self-absorbed Eleanor Shellstrop arrives at the Good Place after her death. Determined to stay, she tries to become a better person.",19
677,s1952,A Perfect Crime,Germany,2020,TV-14,1,"This docuseries investigates the 1991 killing of politician Detlev Rohwedder, an unsolved mystery at the heart of Germany's tumultuous reunification.",18
678,s1953,Mighty Little Bheem,Not Available,2020,TV-Y,3,An innocent toddler’s boundless curiosity – and extraordinary might – lead to mischief and adventure in his small Indian town.,22
679,s1955,Sneakerheads,United States,2020,TV-MA,1,Family man Devin falls back into his sneaker obsession after his pal Bobby talks him into a wheeling-dealing scheme to score a mythical pair of kicks.,14
680,s1956,The School Nurse Files,South Korea,2020,TV-MA,1,"Wielding a light-up sword through the dark corners of a high school, a nurse with an unusual gift protects students from monsters only she can see.",22
681,s1959,The Chef Show,United States,2020,TV-MA,4,"Writer, director and food enthusiast Jon Favreau and chef Roy Choi explore food in and out of the kitchen with accomplished chefs and celebrity friends.",14
682,s1962,The Playbook,United States,2020,TV-MA,1,Coaches with championship résumés share their personal rules for success in sports and life in this reflective and inspiring documentary series.,20
683,s1974,Fukrey Boyzzz,Not Available,2020,TV-Y,1,"A troublemaking trio dreams big, plays hard and stirs up all sorts of classroom mischief in this animated spinoff of the popular Hindi film franchise.",19
684,s1979,Ratched,United States,2020,TV-MA,1,"In 1947, Mildred Ratched begins working as a nurse at a leading psychiatric hospital. But beneath her stylish exterior lurks a growing darkness.",21
685,s1980,The American Barbecue Showdown,United States,2020,TV-G,1,Eight of the country's best backyard smokers and pitmasters vie for the title of American Barbecue Champion in a fierce but friendly faceoff.,14
686,s1981,The Blacklist,United States,2019,TV-14,7,"After turning himself in, a brilliant fugitive offers to help the FBI bag other baddies, but only if rookie profiler Elizabeth Keen is his partner.",13
687,s1984,Dragon's Dogma,Not Available,2020,TV-MA,1,"Resurrected as an Arisen, Ethan sets out to vanquish the Dragon that took his heart. But with every demon he battles, his humanity slips further away.",18
688,s1989,The Last Word,Germany,2020,TV-MA,1,"Suddenly a widow, a woman rekindles her thirst for life by becoming a eulogist while navigating the existential landscape of death, grief and love.",13
689,s1990,Baby,Italy,2020,TV-MA,3,"Fed up with their families and classmates, two teen girls from a wealthy part of Rome are drawn to the city's underworld and start leading double lives.",20
690,s1991,Challenger,United States,2020,TV-14,1,"Engineers, officials and the crew members' families provide their perspective on the 1986 Space Shuttle Challenger disaster and its aftermath.",22
691,s1992,Criminal: UK,United Kingdom,2020,TV-MA,2,"Within the walls of an interrogation room and with time running out, London investigators go after three suspects, each accused of a grievous crime.",19
692,s1994,Signs,Poland,2020,TV-MA,2,"When a young woman's murder shows similarities to a decade-old cold case, a new police commander must break the silence permeating an Owl Mountain town.",15
693,s1995,Sing On!,United States,2020,TV-PG,1,"In this fun, fast-paced music contest hosted by Tituss Burgess, players sing their hearts out and try to hit the right notes to win up to $60,000.",13
694,s1999,Call the Midwife,United Kingdom,2020,TV-MA,9,This period drama set in impoverished East London in the 1950s follows a newly qualified midwife and her colleagues at a nursing convent.,13
695,s2003,Taco Chronicles,United States,2020,TV-MA,2,"Many of the most popular taco styles have long, rich, little-known histories. Explore some of them in this eye-opening, mouth-watering food adventure.",22
696,s2007,Buddi,United Kingdom,2020,TV-Y,2,"The Buddis bounce, spin, glide — and giggle! — through their magical world, learning new things and sharing the joy of friendship.",22
697,s2009,Family Business,France,2020,TV-MA,2,"After learning France is about to legalize pot, a down-on-his-luck entrepreneur and his family race to turn their butcher shop into a marijuana café.",17
698,s2010,Girlfriends,United States,2007,TV-14,8,"Four close friends in Los Angeles challenge and support each other through life's triumphs and disasters. Sophisticated, relatable and always funny.",19
699,s2013,The Barrier,Spain,2020,TV-MA,1,One family’s fight for survival in a future dystopian Madrid illustrates the disparity between two worlds separated by a fence — and so much more.,16
700,s2014,The Duchess,United Kingdom,2020,TV-MA,1,"Katherine's a single mom juggling her career, her tween daughter, her relationship with her boyfriend — and pondering getting pregnant with her ex.",12
701,s2022,Greenleaf,United States,2020,TV-14,5,"Although members of the Greenleaf family run a Memphis megachurch, their business and personal lives are tainted with greed, adultery and other sins.",20
702,s2023,Julie and the Phantoms,United States,2020,TV-G,1,"Julie lost her passion for music when she lost her mom. But when three ghostly guys appear and lift her spirits, they decide to start a band together!",15
703,s2033,Get Organized with The Home Edit,United States,2020,TV-PG,1,"Expert home organizers Clea and Joanna help celebrities and everyday clients edit, categorize and contain their clutter to create stunning spaces.",22
704,s2034,La Línea: Shadow of Narco,Spain,2020,TV-MA,1,"A stone's throw from Africa, the Spanish beach town of La Línea is a drug smuggling hot spot. But the police and mayor are determined to change that.",15
705,s2038,Record of Youth,South Korea,2020,TV-14,1,Two actors and a makeup artist fight to make their own way in a world that weighs the backgrounds they were born into more than their dreams.,17
706,s2041,Transformers: Cyberverse,Not Available,2020,TV-Y7,2,Optimus Prime and the AllSpark are missing – and only a memory-scrambled Bumblebee holds the key to finding them in this animated sci-fi series.,16
707,s2043,Cleverman,Australia,2017,TV-MA,1,"In the near future, physically powerful beings known as ""Hairies"" struggle to survive in a segregated society dominated by hostile humans.",22
708,s2045,Away,United States,2020,TV-14,1,Commander Emma Green leaves behind her husband and daughter to lead an international crew of astronauts on a perilous three-year mission to Mars.,22
709,s2048,Spirit Riding Free: Riding Academy,United States,2020,TV-Y7,2,A new chapter begins for Lucky and her friends as they leave Miradero behind to live and learn at the prestigious Palomino Bluffs Riding Academy.,14
710,s2054,Young Wallander,United Kingdom,2020,TV-MA,1,"An incendiary hate crime stirs civil unrest, fast-tracking rookie cop Kurt Wallander to detective in this origin story for the popular character.",14
711,s2055,Chef's Table: BBQ,United States,2020,TV-14,1,"The Emmy-nominated series delves into the juicy, smoky world of barbecue, visiting acclaimed chefs and pitmasters in the US, Australia and Mexico.",16
712,s2059,The Witcher: A Look Inside the Episodes,Not Available,2020,TV-MA,1,"With series creator Lauren S. Hissrich as your guide, take an in-depth journey into the stories and themes powering the first season of ""The Witcher.""",13
713,s2063,Blue Exorcist,Japan,2017,TV-MA,2,"Determined to throw off the curse of being Satan's illegitimate son, Rin enters the True Cross Academy to become an exorcist, just like his mentor.",17
714,s2064,Bookmarks,United States,2020,TV-Y,1,"Celebrity readers share children's books by Black authors to spark kid-friendly conversations about empathy, equality, self-love and antiracism.",14
715,s2065,Borgen,Denmark,2012,TV-MA,3,A shocking turn of events puts Birgitte Nyborg in the Danish prime minister's seat as her country's first female leader in this landmark drama.,14
716,s2067,Erased,Japan,2016,TV-14,1,"Satoru Fujinuma can travel back in time to save others' lives. When he wakes up 18 years in the past, he has a chance to save his murdered classmates.",14
717,s2069,Felipe Esparza: Bad Decisions,United States,2020,TV-MA,1,"Two live performances, one in English and one in Spanish. No matter the language, Felipe Esparza is muy muy.",16
718,s2070,H,France,2002,TV-MA,4,"At a dysfunctional hospital in Paris, three bumbling, eccentric medical employees embark on zany misadventures with surgical imprecision.",21
719,s2071,Heidi,France,2020,TV-Y7,1,A plucky young orphan sent to live with her grandfather in the mountains discovers wonder and adventure around every corner.,18
720,s2074,"Sister, Sister",United States,1998,TV-PG,6,"Separated at birth, twin sisters Tia Landry and Tamera Campbell reunite after 14 years and soon move in together, blending families and personalities.",20
721,s2079,The Promised Neverland,Japan,2019,TV-14,1,"When three gifted kids learn that their isolated orphanage isn’t the haven they thought, they vow to lead the other children in a risky escape plan.",20
722,s2081,Thomas and Friends,United Kingdom,2020,TV-Y,2,"This animated children's series follows the adventures of Thomas, a cheerful blue tank engine who lives on the island of Sodor.",14
723,s2086,I AM A KILLER: RELEASED,United Kingdom,2020,TV-MA,1,"In this crime docuseries spinoff, a convict is paroled 30 years after being sentenced to death for murder. Then he makes a stunning confession.",12
724,s2087,Masaba Masaba,India,2020,TV-MA,1,"Real life mom-daughter duo Neena and Masaba Gupta play versions of themselves in this playful, fictional peek into their lives in fashion and film.",20
725,s2090,Aggretsuko,Japan,2020,TV-14,3,"Frustrated with her thankless office job, Retsuko the Red Panda copes with her daily struggles by belting out death metal karaoke after work.",17
726,s2094,Her Mother's Killer,Colombia,2020,TV-MA,1,"Nearly 30 years after her mom's murder, a political strategist launches a calculated plan to ruin the Colombian presidential candidate who killed her.",17
727,s2097,Million Dollar Beach House,United States,2020,TV-MA,1,The competition is fierce — and the drama undeniable — as a group of young and hungry agents try to seal the deal on luxury listings in the Hamptons.,21
728,s2099,Emily's Wonder Lab,United States,2020,TV-Y,1,"Science-loving host Emily Calandrelli makes STEAM fun with activities, demonstrations and at-home experiments that'll make you think — and blow your mind!",19
729,s2100,Trinkets,United States,2020,TV-MA,2,A grieving teen finds an unexpected connection with two classmates at her new high school after they all land in the same Shoplifters Anonymous group.,12
730,s2102,Baewatch: Parental Guidance,Not Available,2019,TV-MA,1,"Couples go on a romantic getaway to test their relationships, not knowing their families are calling the shots and cringing over their every move.",18
731,s2103,Ojos in d' House,Nigeria,2013,TV-G,1,"After a newly rich family moves into an upper-class neighborhood, they try to keep their matriarch's obsessive pursuit of social acceptance in check.",19
732,s2106,Hoops,United States,2020,TV-MA,1,A foul-mouthed high school basketball coach is sure he'll hit the big leagues if he can only turn his terrible team around. Good luck with that.,16
733,s2107,Rust Valley Restorers,Canada,2020,TV-14,3,"Old-school auto collector Mike Hall, his pal Avery Shoaf and son Connor Hall go the extra mile to restore retro cars – and hopefully turn a profit.",22
734,s2109,Goedam,South Korea,2020,TV-MA,1,"When night falls on the city, shadows and spirits come alive in this horror anthology series centered on urban legends.",15
735,s2113,DeMarcus Family Rules,United States,2020,TV-14,1,Rascal Flatts bassist Jay DeMarcus and ex-beauty queen Allison DeMarcus write their own rules for juggling family and fun in this reality show.,13
736,s2114,High Score,United States,2020,TV-14,1,"This docuseries traces the history of classic video games, featuring insights from the innovators who brought these worlds and characters to life.",14
737,s2119,Glitch Techs,United States,2020,TV-Y7,2,Two teens work at a game store as a front for their actual job: Hunting video game monsters who've broken out into the real world.,20
738,s2123,Stranger,South Korea,2020,TV-MA,2,"With the help of a gutsy female detective, a prosecutor who has lost the ability to feel empathy tackles a murder case amid political corruption.",16
739,s2124,Dérè: An African Tale,Not Available,2016,TV-PG,1,"After experiencing a tragic loss, a woman must resist a new family dynamic that could control the future of her father's company and her life.",14
740,s2125,Rita,Denmark,2020,TV-MA,5,"Independent, outspoken and adored by her students, schoolteacher Rita fares less well with adults in this comedy-drama from Denmark.",21
741,s2126,Takki,Saudi Arabia,2014,TV-14,2,"In Jeddah, Saudi Arabia, a young aspiring filmmaker and his circle of friends grapple with family expectations, gender roles, romance and rivalry.",16
742,s2128,3%,Brazil,2020,TV-MA,4,"In a future where the elite inhabit an island paradise far from the crowded slums, you get one chance to join the 3% saved from squalor.",14
743,s2134,Teenage Bounty Hunters,United States,2020,TV-MA,1,Twin sisters Sterling and Blair balance teen life at an elite Southern high school with an unlikely new career as butt-kicking bounty hunters.,18
744,s2135,The Great Heist,Colombia,2020,TV-MA,1,"In 1994, a team of thieves plans an ambitious heist to steal millions from Colombia's Bank of the Republic. Inspired by true events.",22
745,s2136,The Legend of Korra,United States,2014,TV-Y7,4,A female avatar who can control the elements fights to keep her city safe from the evil forces of both the physical and spiritual worlds.,22
746,s2137,Zoids Wild,Japan,2018,TV-Y7,1,A quest for freedom and legendary treasure begins when a cheerful young adventurer follows his father's footsteps to become the greatest Zoids hunter.,13
747,s2141,(Un)Well,United States,2020,TV-MA,1,"This docuseries takes a deep dive into the lucrative wellness industry, which touts health and healing. But do the products live up to the promises?",14
748,s2145,GAME ON: A Comedy Crossover Event,United States,2020,TV-G,1,"Worlds collide in this special event featuring familiar faces, surprise cameos and stories of spirited competition from four different comedy series.",14
749,s2146,Terrace House: Tokyo 2019-2020,Japan,2019,TV-MA,2,"Six strangers share a fabulous house in Tokyo, looking for love while living under the same roof. With no script, what happens next is all up to them.",22
750,s2149,The Governor,Nigeria,2016,TV-14,1,"When sudden tragedy forces a deputy to step into the role of governor, she faces grueling political and personal tests in order to lead her state.",22
751,s2152,High Seas,Spain,2020,TV-MA,3,Two sisters discover disturbing family secrets after a string of mysterious deaths occur on a luxury ship traveling from Spain to Brazil in the 1940s.,20
752,s2153,Selling Sunset,Not Available,2020,TV-MA,3,The elite real estate brokers at The Oppenheim Group sell the luxe life to affluent buyers in LA. The drama ramps up when a new agent joins the team.,22
753,s2154,Sing On! Germany,Germany,2020,TV-PG,1,"In this karaoke competition hosted by Palina Rojinski, contestants must hit the right note for a chance to win up to 30,000 euros.",19
754,s2157,Tiny Creatures,United States,2020,TV-PG,1,Little animals embark on big adventures across the U.S. in a dramatic nature series that explores their hidden worlds and epic survival stories.,12
755,s2158,Wizards: Tales of Arcadia,United States,2020,TV-Y7,1,"Merlin’s apprentice joins Arcadia’s heroes on a time-bending adventure in Camelot, where conflict is brewing between the human, troll and magical worlds.",22
756,s2159,Word Party Songs,United States,2020,TV-Y,1,"Sing along and dance with Bailey, Franny, Kip, Lulu and Tilly in this collection of music videos that will get you in the mood to move and groove!",19
757,s2161,Ever After High,Canada,2016,TV-Y7,5,The kids of fairy-tale characters attend a school with two cliques: those who accept their fairy-tale destinies and those who want to write their own.,12
758,s2163,The Rain,Denmark,2020,TV-MA,3,"Six years after a brutal virus wipes out most of Scandinavia's population, two siblings join a band of young survivors seeking safety – and answers.",16
759,s2166,World's Most Wanted,United States,2020,TV-14,1,"Suspected of heinous crimes, they’ve avoided capture despite massive rewards and global investigations. A docuseries profiling the world’s most wanted.",17
760,s2169,Mystery Lab,Brazil,2020,TV-PG,1,"Host Felipe Castanhari explores science, history, mysteries and marvels, uncovering mind-blowing facts with help from his lab buddies.",13
761,s2171,Immigration Nation,United States,2020,TV-MA,1,"With unprecedented access to ICE operations, as well as moving portraits of immigrants, this docuseries takes a deep look at US immigration today.",16
762,s2174,Moesha,United States,2000,TV-PG,6,"Navigating the twists and firsts of high school, Moesha juggles friendships, romance and the occasional drama while trying to keep her family together.",22
763,s2175,My Perfect Landing,Canada,2020,TV-G,1,Everything changes for talented young gymnast Jenny Cortez when she moves with her family from Miami to Toronto to open a new gymnastics club.,20
764,s2176,Nagi-Asu: A Lull in the Sea,Japan,2014,TV-14,1,"In a world where humans are divided between the land and the sea, four childhood friends from the ocean must attend middle school on the surface.",19
765,s2179,The Next Step,Canada,2018,TV-G,1,This drama series follows young dancers at the Next Step Dance Studio as they attempt to win the coveted regional dance championships.,22
766,s2181,Toradora!,Japan,2008,TV-14,1,"Menacing in appearance but gentle at heart, Ryūji forms an unlikely friendship with Taiga, a tiny girl with a sharp tongue and a tough attitude.",21
