,show_id,title,country,release_year,is_adult,num_seasons,description,num_episodes
1279,s3588,Victim Number 8,Spain,2018,TV-MA,1,No one can be trusted after a terrorist bombing in Bilbao kills seven and destroys the lives of the suspected jihadi and everyone around him.,17
1280,s3589,Cannon Busters,United States,2019,TV-MA,1,Immortal renegade Philly the Kid and his transforming pink Cadillac join a relentlessly upbeat friendship droid on her quest to find a missing prince.,13
1281,s3590,Sacred Games,India,2019,TV-MA,2,"A link in their pasts leads an honest cop to a fugitive gang boss, whose cryptic warning spurs the officer on a quest to save Mumbai from cataclysm.",17
1282,s3591,Til Death Do Us Part,Taiwan,2019,TV-MA,1,"Based on the speculative short stories of MirrorFiction, this sci-fi thriller anthology plunges headlong into our deepest desires – and darkest fears.",16
1283,s3593,Happy Jail,Not Available,2019,TV-MA,1,"The Philippine jail known for a viral Michael Jackson dance video comes under the management of an ex-convict, sparking controversy and criticism.",15
1284,s3598,Knightfall,United States,2019,TV-MA,2,"Fifteen years after the Crusades ended in defeat, a veteran knight becomes master of his order's Paris temple and discovers a shocking secret.",14
1285,s3599,DC Super Hero Girls,United States,2019,TV-Y7,1,"As Metropolis High students, super teens Wonder Woman, Supergirl, Bumblebee, Batgirl, Zatanna, and Green Lantern fight crime, classwork and crushes.",16
1286,s3601,GLOW,United States,2019,TV-MA,3,"In 1980s LA, a crew of misfits reinvent themselves as the Gorgeous Ladies of Wrestling. A comedy by the team behind ""Orange Is the New Black.""",19
1287,s3602,IZombie,United States,2019,TV-MA,5,A medical student-turned-zombie tries to retain her humanity by eating brains at the morgue and finds she has an uncanny new gift for solving crimes.,22
1288,s3605,Sintonia,Brazil,2019,TV-MA,1,"Three teens living in the same São Paulo favela pursue their dreams while maintaining their friendship, amid a world of music, drugs and religion.",22
1289,s3606,The Family,United States,2019,TV-14,1,"An enigmatic conservative Christian group known as the Family wields enormous influence in Washington, D.C., in pursuit of its global ambitions.",18
1290,s3607,Bad Guys,South Korea,2014,TV-MA,1,"Reinstated to eradicate the worst crimes in the city, a detective requests the release of three convicts to enlist their help in catching the felons.",15
1291,s3608,Dollar,Lebanon,2019,TV-MA,1,Beautiful executive assistant Zeina reluctantly teams up with the self-assured Tarek to chase down an elusive dollar bill worth $1 million.,12
1292,s3609,Jane The Virgin,United States,2019,TV-14,5,"After vowing to remain chaste until marriage, Jane Villanueva learns she's pregnant due to a medical slip-up and has to rethink her future.",19
1293,s3610,Let's Eat 2,Malaysia,2015,TV-MA,1,Two classmates from elementary school reunite as next-door neighbors and discover their relationship was – and still is – defined by food.,13
1294,s3611,Let’s Eat,South Korea,2013,TV-PG,1,"With the help of her neighbors, a divorced woman residing in a one-person-household apartment complex learns to balance living alone and eating well.",15
1295,s3612,Misaeng,South Korea,2014,TV-MA,1,"Equipped with nothing more than a GED and strategies for the game of go, an office intern gets thrown into the cold reality of the corporate world.",18
1296,s3613,Oh My Ghost,South Korea,2015,TV-MA,1,"Possessed by the ghost of a lustful virgin, a timid assistant chef becomes confidently libidinous, drawing the attention of a haughty culinary star.",20
1297,s3614,Reply 1994,South Korea,2014,TV-MA,1,"All hailing from various parts of Korea, a group of college students go from being complete strangers to a big happy family at a Seoul boarding house.",15
1298,s3615,Reply 1997,South Korea,2012,TV-MA,1,"As a teen, Shi Won was obsessed with a boy band. Now 33 years old, Shi Won and her friends are reviving their memories as their school reunion nears.",18
1299,s3616,Wu Assassins,United States,2019,TV-MA,1,An unassuming San Francisco chef becomes the latest in a long line of assassins chosen to keep the mystical Wu powers out of the wrong hands.,16
1300,s3625,No Good Nick,United States,2019,TV-PG,2,"A family finds their lives turned upside down when a teenage con artist shows up on their doorstep, claiming she's a distant relative.",12
1301,s3628,Basketball or Nothing,United States,2019,TV-PG,1,Follow the Chinle High basketball team in Arizona's Navajo Nation on a quest to win a state championship and bring pride to their isolated community.,21
1302,s3633,Sleepless Society: Nyctophobia,Thailand,2019,TV-MA,1,"Following the death of her child, a grief-stricken woman struggles to find peace until a mysterious boy appears, claiming to be her reincarnated son.",12
1303,s3634,The Letdown,Australia,2019,TV-MA,2,"Audrey, mother of a 2-month-old, joins a new-parents support group, where she makes some quirky friends facing various challenges and life changes.",12
1304,s3637,Twelve Forever,United States,2019,TV-PG,1,Reggie's wild imagination unlocks a weird and wonderful world where she can be herself – and escape the pressures of growing up.,13
1305,s3641,My First First Love,South Korea,2019,TV-14,2,"Due to various personal reasons, a group of Yun Tae-o’s friends move into his house, where they experience love, friendship, and everything in between.",16
1306,s3643,Another Life,United States,2019,TV-MA,1,"After a massive alien artifact lands on Earth, Niko Breckinridge leads an interstellar mission to track down its source and make first contact.",14
1307,s3645,Beat Bugs,Australia,2018,TV-Y,3,"With songs made famous by the Beatles, five friendly bugs learn big lessons about the world around them – all from the safety of their own backyard.",20
1308,s3652,Sexy Central,Hong Kong,2019,TV-MA,1,"In the bustling center of Hong Kong, five young women reckon with betrayal, unrequited love and other matters of the heart.",21
1309,s3654,Comedians in Cars Getting Coffee,United States,2019,TV-14,6,"Jerry Seinfeld's roving talk show combines coffee, laughs and vintage cars into quirky, caffeine-fueled adventures with the sharpest minds in comedy.",16
1310,s3655,The Epic Tales of Captain Underpants,United States,2019,TV-Y7,3,Fourth-grade friends George and Harold have a shared love of pranks and comic books – and turning their principal into an undies-wearing superhero.,13
1311,s3656,Typewriter,India,2019,TV-MA,1,"Three young friends in Goa plan to search an old villa for ghosts, but when a new family moves in, the home’s buried past resurfaces in chilling ways.",21
1312,s3657,Rookie Historian Goo Hae-Ryung,South Korea,2019,TV-14,1,Free spirit Goo Hae-ryung embarks on a new life as a scholar in the Joseon royal court after hearing about a government post for women historians.,20
1313,s3660,Pinky Malinky,United States,2019,TV-Y7,3,"Pinky Malinky sees the bright side of everything, including being born a hot dog. With his BFFs in tow, this little wiener takes a bite out of life.",14
1314,s3661,Unrequited Love,China,2019,TV-14,1,"A complicated, one-sided secret attraction sends ripples through the lives of a mild-mannered student and her dashing classmate.",13
1315,s3664,Angel Beats!,Japan,2010,TV-PG,1,"In a high school that's a way station to the afterlife, a teenager gets caught up in the battle for the rights of those in this purgatorial world.",17
1316,s3665,Anohana: The Flower We Saw That Day,Japan,2011,TV-14,1,A teen haunted by the spirit of an old friend summons the other members of their childhood club to help fulfill the girl's final wish.,20
1317,s3666,God Eater,Japan,2015,TV-14,1,An enemy immune to conventional arms has caused the collapse of civilization and humanity's only hope lies in a new living weapon: the God Arc.,13
1318,s3667,GRANBLUE FANTASY the Animation,Japan,2017,TV-PG,1,"In a world where islands float in the sky, Gran encounters a mysterious girl wanted by the Erste Empire for her ability to summon Primal Beasts.",22
1319,s3668,3Below: Tales of Arcadia,United States,2019,TV-Y7,2,"After crash-landing on Earth, two royal teen aliens on the run struggle to blend in with humans as they evade intergalactic bounty hunters.",16
1320,s3670,Bonus Family,Sweden,2019,TV-MA,3,"A new couple, their exes and their children navigate the emotional challenges and tricky logistics of blended family life in this Swedish dramedy.",16
1321,s3672,Extreme Engagement,Not Available,2019,TV-MA,1,An engaged couple travels the world for a year to explore marriage customs in diverse cultures. Will the journey bring them closer or tear them apart?,14
1322,s3674,One Spring Night,South Korea,2019,TV-14,1,"When Lee Jeong-in and Yu Ji-ho meet, something unexpected happens. Or it just may be that spring is in the air – and anything is possible.",13
1323,s3675,PILI Fantasy: War of Dragons,Not Available,2019,TV-14,1,"As turmoil looms in the Martial World, and the Eight Wonders of the Evil Dragon unleashes dark forces, who will emerge as the new warrior legend?",18
1324,s3678,True Tunes,Not Available,2019,TV-Y,1,"True and her friends are dropping sweet, silly beats with freshly modern music videos set to the sounds of classic nursery rhyme songs.",16
1325,s3681,Free Rein,United States,2019,TV-G,3,"A 15-year-old from LA spends the summer at her mom's childhood home on an island off the coast of England, where she bonds with a mysterious horse.",13
1326,s3683,The Legend of White Snake,China,2019,TV-14,1,"In this new take on a classic tale, an ancient snake spirit transforms into a beautiful woman and falls in love with a doctor unaware of her true form.",20
1327,s3685,Kakegurui,Not Available,2019,TV-MA,2,"Yumeko Jabami enrolls at Hyakkaou Private Academy, where students are ranked by their gambling winnings and fame and fortune awaits those on top.",22
1328,s3686,Stranger Things,United States,2019,TV-14,3,"When a young boy vanishes, a small town uncovers a mystery involving secret experiments, terrifying supernatural forces and one strange little girl.",18
1329,s3687,The Last Czars,United States,2019,TV-MA,1,"When social upheaval sweeps Russia in the early 20th century, Czar Nicholas II resists change, sparking a revolution and ending a dynasty.",19
1330,s3688,Yummy Mummies,Australia,2019,TV-MA,2,It's drama Down Under when expectant mothers with model good looks and lavish lifestyles pull out all the stops to prepare for their new arrivals.,21
1331,s3689,Bangkok Love Stories: Objects of Affection,Thailand,2019,TV-14,1,A kind computer repairman falls for a street-smart graffiti artist whose multiple personality disorder worsens after she witnesses a double murder.,19
1332,s3690,Bangkok Love Stories: Plead,Thailand,2019,TV-14,1,"In Bangkok's Chinatown, a spirited digital marketing expert falls for a blind fortune-teller, but their love is predestined to end in disaster.",14
1333,s3691,Designated Survivor: 60 Days,South Korea,2019,TV-14,1,"When the National Assembly suffers a catastrophic attack, Minister of Environment Park Mu-jin must find a way to lead Korea through the ensuing chaos.",17
1334,s3692,DreamWorks Kung Fu Panda Awesome Secrets,United States,2008,TV-PG,1,"In this pair of adventures, Po tells the story of how masters Thundering Rhino, Storming Ox and Croc met and takes on Shifu's biggest challenge yet.",12
1335,s3693,Hatchimals | Adventures in Hatchtopia,United States,2018,TV-Y,2,"These fun-loving creatures hatch from their shells and spread friendship, laughter and life lessons in the land of Hatchtopia.",13
1336,s3695,Molang,France,2015,TV-Y,1,"An imaginative, big-hearted bunny and his friend, a shy chick, explore the everyday joys of their pastel-colored world.",20
1337,s3696,Rabbids Invasion,France,2018,TV-Y7,1,"Giant, rambunctious rabbits have invaded and are wreaking havoc on the world. But we'll have to get used to them, because they're not going anywhere!",17
1338,s3697,Record of Grancrest War,Japan,2018,TV-MA,1,"Lone mage Siluca wanders the land of Atlatan, disgusted by its greedy nobility. When she meets knight errant Theo, she sees a chance to create peace.",14
1339,s3701,Scare Tactics,United States,2011,TV-MA,2,This ghoulish but hilarious hidden-camera show from Syfy finds mischievous friends and family members setting up unsuspecting victims for elaborate pranks that use high-quality makeup and special effects to unleash their worst fears upon them.,22
1340,s3703,Dope,United States,2019,TV-MA,3,"Filmed from the perspectives of dealers, users and the police, this vivid series offers a bracing look at the war on drugs.",21
1341,s3705,Exhibit A,United States,2019,TV-MA,1,This true crime series shows how innocent people have been convicted with dubious forensic techniques and tools such as touch DNA and cadaver dogs.,13
1342,s3706,Instant Hotel,Australia,2019,TV-MA,2,Teams of Australian homeowners compete for the title of best Instant Hotel by staying overnight in each other's rentals and rating their experience.,20
1343,s3708,Motown Magic,Australia,2019,TV-Y,2,"Imaginative boy Ben transforms his city by bringing colorful street art to life, armed with a magic paintbrush – and the classic sounds of Motown.",17
1344,s3709,Paquita Salas,Spain,2018,TV-MA,3,"One of Spain's best talent agents in the '90s, Paquita now finds herself searching desperately for new stars after suddenly losing her biggest client.",17
1345,s3711,Answer for Heaven,Not Available,2019,TV-MA,1,An angel falls to earth to investigate why humans are doing fewer good deeds – and falls in with a hard-charging crime reporter and his news team.,13
1346,s3717,Forest of Piano,Japan,2019,TV-14,2,Kai grows up playing an old piano discarded in the woods; Shuhei's father is a famous pianist. Their chance meeting transforms their lives and music.,15
1347,s3720,Bolívar,Colombia,2019,TV-MA,1,"This dramatization depicts the life – and loves – of Venezuelan Gen. Simón Bolívar, who helped liberate several Latin American countries from Spain.",13
1348,s3722,Girls Incarcerated,United States,2019,TV-MA,2,"Fights, friendships, dating, rules. Teenage life is full of drama. But behind bars, the stakes are so much higher.",16
1349,s3723,Go! Live Your Way,Argentina,2019,TV-PG,2,"Charismatic Mía gets a scholarship to an elite performing arts school, where she makes close friends but clashes with the owner's popular daughter.",18
1350,s3724,Magi: The Labyrinth of Magic,Japan,2013,TV-MA,2,A land of mysterious ruins and a magical treasure hunt await young Aladdin and his courageous friend Alibaba for the adventure of their lives.,22
1351,s3725,Neon Genesis Evangelion,Japan,1995,TV-MA,1,"Fifteen years after the Second Impact, Shinji Ikari joins his father's group NERV as one of several teenage mecha pilots fighting the monstrous Angels.",17
1352,s3726,Shooter,United States,2018,TV-14,3,"A highly decorated ex-Marine sniper returns to action to foil an assassination plot targeting the president, but soon finds himself framed for murder.",13
1353,s3727,The Casketeers,New Zealand,2019,TV-14,2,Māori funeral directors Francis and Kaiora Tipene and staff temper good humor with care and respect as they help Polynesian families cope with loss.,21
1354,s3728,The Confession Tapes,United States,2019,TV-MA,2,"This true crime documentary series investigates cases where people convicted of murder claim their confessions were coerced, involuntary or false.",19
1355,s3737,Fate/Zero,Japan,2012,TV-MA,2,"After three unsettled battles for the mystical Holy Grail, an artifact that grants a miracle to those who hold it, a fourth war begins.",22
1356,s3738,Kill la Kill,Japan,2014,TV-MA,1,"The ""woman with the scissor blade"" – Ryuko Matoi – searches for clues all around the world for the truth behind her father's death.",14
1357,s3742,Puella Magi Madoka Magica,Japan,2011,TV-14,1,"One day, Madoka Kaname has a very magical encounter, one that can change her destiny. This is the beginning of the new story of magical witch girls.",19
1358,s3743,Somewhere Only We Know,China,2019,TV-MA,1,A language major bickers with – and falls for – a doctoral student as she navigates the ups and downs of love and friendship with college classmates.,21
1359,s3744,The Alcàsser Murders,Spain,2019,TV-MA,1,New interviews and an up-to-date analysis of evidence shed light on the 1992 murders of three girls in Spain and their profound impact on the nation.,14
1360,s3745,Unit 42,Belgium,2017,TV-MA,1,A widowed cop tapped to lead a special cybercrimes unit teams up with a former hacker to hunt down tech-savvy criminals who are terrorizing Belgium.,17
1361,s3746,Awake: The Million Dollar Game,United States,2019,TV-PG,1,"Sleepless for 24 hours, contestants in the comedy game show stumble through challenges both eccentric and everyday for a chance at a $1 million prize.",20
1362,s3747,Black Spot,France,2019,TV-MA,2,A police chief and an eccentric new prosecutor investigate a string of grisly crimes and eerie phenomena in an isolated town at the edge of a forest.,13
1363,s3749,El desconocido,Not Available,2019,TV-MA,2,"Based on real events, the fictional story of Mexican drug lord El Chato's number one hitman, El Cholo.",16
1364,s3750,Girlfriends' Guide to Divorce,United States,2019,TV-MA,5,"After the world learns the truth about her failing marriage, a successful self-help author tries to salvage her career and find her way as a divorcée.",20
1365,s3751,Leila,India,2019,TV-MA,1,"In a near-future world where an oppressive regime segregates society, one woman skirts the system to search for the daughter taken from her years ago.",15
1366,s3752,Marlon,United States,2018,TV-14,2,"After the friendliest divorce ever, a carefree but devoted father navigates post-split parenting life with his levelheaded ex-wife and two kids.",13
1367,s3753,Marvel's Jessica Jones,United States,2019,TV-MA,3,"Haunted by a traumatic past, Jessica Jones uses her gifts as a private eye to find her tormentor before he can harm anyone else in Hell's Kitchen.",18
1368,s3755,Yankee,Mexico,2019,TV-MA,1,"On the run from the police, an Arizona man crosses into Mexico and gets deeply involved in drug trafficking – with the help of modern technology.",16
1369,s3756,Jinn,Jordan,2019,TV-MA,1,"On a field trip to Petra, two jinns – one good, the other evil – enter the human realm, turning high school into a supernatural battleground.",12
1370,s3761,Upin & Ipin,Malaysia,2011,TV-Y,1,Two mischievous yet lovable five-year-old twins and their friends enjoy daily life and new discoveries with the residents of their Malaysian village.,13
1371,s3763,Designated Survivor,United States,2019,TV-MA,3,America's fate rests in the hands of a low-level official after an attack on Washington decimates the government in this gripping political thriller.,17
1372,s3770,Super Monsters Monster Pets,United States,2019,TV-Y,1,The adorably magical Monster Pets star in a series of short adventures that are big on fun – and full of surprises!,12
1373,s3771,Tales of the City,United States,2019,TV-MA,1,"Returning to San Francisco after a long absence, Mary Ann Singleton reunites with the community of characters at 28 Barbary Lane.",14
1374,s3775,Black Mirror,United Kingdom,2019,TV-MA,5,"This sci-fi anthology series explores a twisted, high-tech near-future where humanity's greatest innovations and darkest instincts collide.",12
1375,s3779,Documentary Now!,United States,2019,TV-14,3,"Elevating the art of parody, this sharply comic series spoofs high-profile documentaries such as ""Grey Gardens"" and ""The Thin Blue Line.""",19
1376,s3780,Malibu Rescue: The Series,United States,2019,TV-G,1,"On the heels of Junior Rescue training, Team Flounder returns to brave the beach in a series of thrilling saves and lighthearted laughs.",15
1377,s3781,Arthdal Chronicles,South Korea,2019,TV-MA,1,"In a mythical land called Arth, the inhabitants of the ancient city of Arthdal and its surrounding regions vie for power as they build a new society.",16
1378,s3783,A Thousand Goodnights,Taiwan,2019,TV-14,1,"To carry out her dad's wish and discover her roots, Dai Tian-qing embarks on a journey around Taiwan and finds love and redemption on the way.",13
1379,s3785,March Comes in Like a Lion,Japan,2017,TV-14,2,"Orphaned young, a reclusive 17-year-old professional shogi player starts to come out of his shell when three sisters take him under their wing.",17
1380,s3788,Bad Blood,Canada,2019,TV-MA,2,"This sprawling crime drama follows the true story of the Rizzuto family and its associates, who presided over organized crime in Montreal for decades.",14
1381,s3790,Killer Ratings,Not Available,2019,TV-MA,1,Brazilian TV personality and politician Wallace Souza faces accusations of masterminding the violent crimes he reported on and rallied against.,18
1382,s3793,When They See Us,United States,2019,TV-MA,1,Five teens from Harlem become trapped in a nightmare when they're falsely accused of a brutal attack in Central Park. Based on the true story.,22
1383,s3795,Historical Roasts,United States,2019,TV-MA,1,"""Roastmaster General"" Jeff Ross and a slew of guest stars poke fun at major historical figures while also honoring their enduring impact on the world.",21
1384,s3797,Hyper HardBoiled Gourmet Report,Not Available,2017,TV-MA,1,"To live is to eat. For people around the world in precarious and dangerous circumstances, eating itself is dangerous, precarious – and essential.",22
1385,s3800,She's Gotta Have It,United States,2018,TV-MA,2,Nola Darling struggles to stay true to herself and her dreams while juggling three lovers in this Spike Lee series based on his breakout film.,20
1386,s3802,WHAT / IF,United States,2019,TV-MA,1,"Desperate to secure funding for her med tech startup, an idealistic scientist and her husband strike an outrageous deal with a mysterious investor.",17
1387,s3807,Prince of Peoria,United States,2019,TV-G,2,A prankster prince who wants to experience life as an ordinary teen leaves his kingdom to live incognito with a single mom and her studious son.,21
1388,s3808,Rosario Tijeras,Mexico,2018,TV-MA,2,Worlds collide when a vengeance-obsessed young woman from the other side of the tracks captures the attention of two well-off friends.,17
1389,s3809,1994,Mexico,2019,TV-MA,1,"Archival video and new interviews examine Mexican politics in 1994, a year marked by the rise of the EZLN and the assassination of Luis Donaldo Colosio.",21
1390,s3813,It's Bruno!,United States,2019,TV-MA,1,"An old-school Brooklyn native devotes his days to caring for his adorable dog, Bruno – and making sure the neighbors show his pooch the proper respect.",14
1391,s3818,White Gold,United Kingdom,2019,TV-MA,2,"In 1980s Essex, cocky salesman Vincent Swan and his unscrupulous team will do anything to get the sale – including throwing honesty out the window.",22
1392,s3822,Dennis and Gnasher Unleashed,United Kingdom,2017,TV-Y,1,"Fearless Dennis, his loyal dog Gnasher and best friends Rubi, JJ and Pieface quench their thirst for adventure by wreaking havoc all over Beanotown.",20
1393,s3824,"Heidi, bienvenida a casa",Argentina,2017,TV-Y,1,"Inspired by the classic novel, this telenovela follows Heidi, who leaves her happy life in the mountains behind when her aunt takes her to the big city.",13
1394,s3825,I Hear You,Not Available,2019,TV-14,1,"Love blooms between a bubbly, aspiring voice actress and a cool, enigmatic violin-maker after they cross paths on a reality TV show.",16
1395,s3827,Revisions,Japan,2018,TV-14,1,"When Shibuya time-warps to 2388, high schooler Daisuke and his friends are conscripted by AHRV agent Milo to fight the hostile cyborg race, revisions.",13
1396,s3832,The Defected,China,2019,TV-14,1,"After surviving a near-fatal injury on the job, a cop sets out to investigate a conspiracy involving the top brass of the police department.",14
1397,s3836,Easy,United States,2019,TV-MA,3,"This eclectic, star-studded anthology follows diverse Chicagoans fumbling through the modern maze of love, sex, technology and culture.",13
1398,s3838,Jailbirds,Not Available,2019,TV-MA,1,"At the Sacramento County Jail, incarcerated women fight the power and one another as they try to make the best of life – and love – on the inside.",16
1399,s3839,The Mechanism,Brazil,2019,TV-MA,2,A scandal erupts in Brazil during an investigation of alleged government corruption via oil and construction companies. Loosely inspired by true events.,19
1400,s3840,The Princess Weiyoung,China,2016,TV-14,1,A princess descended from a ruined noble family disguises herself as the woman who saved her life and embarks on a mission to avenge her loved ones.,14
1401,s3841,The Society,United States,2019,TV-MA,1,"When everyone else mysteriously vanishes from their wealthy town, the teen residents of West Ham must forge their own society to survive.",21
1402,s3844,Away From Home,Not Available,2015,TV-PG,1,A high-achieving 11-year-old student embarks on a journey of self-discovery at a school on a nearby island as he grapples with tensions at home.,16
1403,s3845,Bibik-Bibikku,Not Available,2016,TV-PG,1,"When a busy mother and father realize they need help with their two young children, they hire a series of maids, often with humorous results.",22
1404,s3846,Cinta 100KG,Not Available,2016,TV-14,1,"Two female friends, each with confidence issues, help each other search for true love and deal with their romantic rivals.",21
1405,s3847,Cinta Iris,Not Available,2015,TV-PG,1,"Dedicated engineering student Iris succumbs to love and marries, but fate holds both tragedies and triumphs for her personal and professional life.",13
1406,s3848,Cinta Si Wedding Planner,Not Available,2015,TV-14,1,A wedding planner and an ex-Marine both have been unlucky in love. But a chance meeting and a spat over a parking space soon change all that.,14
